{
  "schema_version": "1.0.0",
  "registry_id": "hippocampus-foundation-sources-v1",
  "generated_at": "2026-08-16T11:43:22Z",
  "storage_requirements": [
    {
      "locator_id": "drive_lake",
      "provider": "google_drive_shared_drive",
      "identity": "Shared drives/Data/graph-memory-data-lake",
      "required_root": "/content/drive/Shareddrives/Data/graph-memory-data-lake",
      "environment": "Google Colab with the authorized shared Drive mounted at /content/drive",
      "verification": "Resolve the registered absolute root without symlinks, then hash every artifact from raw bytes. A similarly named local directory is not interchangeable."
    }
  ],
  "sources": [
    {
      "source_id": "wikidata@20260720-json",
      "publisher": "Wikimedia Foundation",
      "version": "20260720",
      "snapshot_at": "2026-07-20T00:00:00Z",
      "role": "foundation_candidate",
      "trust_level": "publisher_primary",
      "admission_status": "accepted",
      "admission_reason": "Pinned official full JSON dump preserves statements, ranks, qualifiers, references, and sitelinks; byte admission remains conditional on the clean-room source audit.",
      "licence": {
        "identifier": "CC0-1.0",
        "terms_url": "https://www.wikidata.org/wiki/Wikidata:Licensing",
        "review_status": "approved",
        "commercial_use": "allowed",
        "allowed_uses": ["acquire", "inventory", "quarantine", "train", "redistribute"],
        "reviewer": "codex-primary-source-review",
        "reviewed_at": "2026-08-16T11:43:22Z"
      },
      "artifacts": [
        {
          "artifact_id": "wikidata-20260720-all-json-bz2",
          "locator_id": "drive_lake",
          "filename": "raw/wikidata/2026-07-20/wikidata-20260720-all.json.bz2",
          "source_url": "https://dumps.wikimedia.org/wikidatawiki/entities/20260720/wikidata-20260720-all.json.bz2",
          "media_type": "application/json",
          "compression": "bzip2",
          "expected_bytes": 102354154676,
          "checksums": [
            {
              "algorithm": "sha1",
              "value": "2acc94e09ef1c2c39bf996eb6f23c43c491f8d0d",
              "origin": "publisher",
              "verified": true
            }
          ],
          "raw_policy": "immutable",
          "integrity_status": "unverified"
        }
      ],
      "inventory": {
        "compressed_bytes": {"status": "not_measured", "value": null, "reason": "Clean-room byte audit has not run."},
        "materialised_bytes": {"status": "not_measured", "value": null, "reason": "Phase 0 does not materialise the dump."},
        "documents": {"status": "not_applicable", "value": null, "reason": "The unit is a Wikidata entity, not a document."},
        "document_versions": {"status": "not_applicable", "value": null, "reason": "The pinned dump contains one entity snapshot."},
        "tokens": {"status": "not_measured", "value": null, "reason": "Tokenisation is outside Phase 0."},
        "nodes": {"status": "not_measured", "value": null, "reason": "Streaming entity inventory has not run."},
        "edges": {"status": "not_measured", "value": null, "reason": "Streaming statement inventory has not run."},
        "qualifiers": {"status": "not_measured", "value": null, "reason": "Streaming qualifier inventory has not run."},
        "evidence_spans": {"status": "not_applicable", "value": null, "reason": "Wikidata references are structured records, not source-text spans."},
        "rejected_records": {"status": "not_measured", "value": null, "reason": "Streaming parse validation has not run."}
      },
      "quarantine_required": true,
      "leakage_status": "not_audited"
    },
    {
      "source_id": "wikidata@20260812-legacy-lake",
      "publisher": "Wikimedia Foundation",
      "version": "20260812",
      "snapshot_at": "2026-08-12T00:00:00Z",
      "role": "forensic_only",
      "trust_level": "legacy_unreviewed",
      "admission_status": "blocked",
      "admission_reason": "Files were acquired before this clean-room control plane. Historical sizes and hashes are selectors only until independently re-audited; the truthy export also omits information required by the foundation contract.",
      "licence": {
        "identifier": "CC0-1.0",
        "terms_url": "https://www.wikidata.org/wiki/Wikidata:Licensing",
        "review_status": "approved",
        "commercial_use": "allowed",
        "allowed_uses": ["acquire", "inventory", "quarantine", "train", "redistribute"],
        "reviewer": "codex-primary-source-review",
        "reviewed_at": "2026-08-16T11:43:22Z"
      },
      "artifacts": [
        {
          "artifact_id": "wikidata-20260812-lexemes-json-bz2",
          "locator_id": "drive_lake",
          "filename": "raw/wikidata/2026-08-12/wikidata-20260812-lexemes.json.bz2",
          "source_url": "https://dumps.wikimedia.org/wikidatawiki/entities/20260812/wikidata-20260812-lexemes.json.bz2",
          "media_type": "application/json",
          "compression": "bzip2",
          "expected_bytes": 442289093,
          "checksums": [
            {"algorithm": "sha1", "value": "89a9595d624efdc0f55951b4f432345eaa1cdcca", "origin": "publisher", "verified": false},
            {"algorithm": "sha256", "value": "2ad38ef0e85e598fbcd45e151d5e04ded5a435afe0c6352592c57152805ee41f", "origin": "local", "verified": false}
          ],
          "raw_policy": "immutable",
          "integrity_status": "unverified"
        },
        {
          "artifact_id": "wikidata-20260812-truthy-nt-bz2",
          "locator_id": "drive_lake",
          "filename": "raw/wikidata/2026-08-12/wikidata-20260812-truthy-BETA.nt.bz2",
          "source_url": "https://dumps.wikimedia.org/wikidatawiki/entities/20260812/wikidata-20260812-truthy-BETA.nt.bz2",
          "media_type": "application/n-triples",
          "compression": "bzip2",
          "expected_bytes": 43252160708,
          "checksums": [
            {"algorithm": "sha1", "value": "54892492cfbdcacc6a2ebbf06cbab319b306354c", "origin": "publisher", "verified": false},
            {"algorithm": "sha256", "value": "cfb0438796aa984b420ef167696f92439eed216a9f3ff873900dd0e6d3a9ef23", "origin": "local", "verified": false}
          ],
          "raw_policy": "immutable",
          "integrity_status": "unverified"
        }
      ],
      "inventory": {
        "compressed_bytes": {"status": "not_measured", "value": null, "reason": "Only pre-clean-room observations exist."},
        "materialised_bytes": {"status": "not_measured", "value": null, "reason": "No clean-room materialisation exists."},
        "documents": {"status": "not_applicable", "value": null, "reason": "The unit is a Wikidata entity or lexeme."},
        "document_versions": {"status": "not_applicable", "value": null, "reason": "The dumps are snapshots."},
        "tokens": {"status": "not_measured", "value": null, "reason": "Tokenisation is outside Phase 0."},
        "nodes": {"status": "not_measured", "value": null, "reason": "Clean-room streaming inventory has not run."},
        "edges": {"status": "not_measured", "value": null, "reason": "Clean-room streaming inventory has not run."},
        "qualifiers": {"status": "not_measured", "value": null, "reason": "Clean-room streaming inventory has not run."},
        "evidence_spans": {"status": "not_applicable", "value": null, "reason": "No source-text spans are represented."},
        "rejected_records": {"status": "not_measured", "value": null, "reason": "Clean-room parsing has not run."}
      },
      "quarantine_required": true,
      "leakage_status": "blocked"
    },
    {
      "source_id": "enwiki@20260801-legacy-lake",
      "publisher": "Wikimedia Foundation",
      "version": "20260801",
      "snapshot_at": "2026-08-01T00:00:00Z",
      "role": "forensic_only",
      "trust_level": "legacy_unreviewed",
      "admission_status": "blocked",
      "admission_reason": "Files were acquired before the clean-room boundary. Historical hashes are retained only as expected selectors; current bytes, licensing obligations, and leakage closure must be independently audited.",
      "licence": {
        "identifier": "CC-BY-SA-4.0-and-GFDL",
        "terms_url": "https://dumps.wikimedia.org/legal.html",
        "review_status": "pending",
        "commercial_use": "unclear",
        "allowed_uses": [],
        "reviewer": null,
        "reviewed_at": null
      },
      "artifacts": [
        {
          "artifact_id": "enwiki-20260801-redirect-sql-gz",
          "locator_id": "drive_lake",
          "filename": "raw/wikipedia-en/2026-08-01/enwiki-20260801-redirect.sql.gz",
          "source_url": "https://dumps.wikimedia.org/enwiki/20260801/enwiki-20260801-redirect.sql.gz",
          "media_type": "application/sql",
          "compression": "gzip",
          "expected_bytes": 185009639,
          "checksums": [
            {"algorithm": "sha1", "value": "448446698ab5edbe756ca92c39b217790e4bfb56", "origin": "publisher", "verified": false},
            {"algorithm": "sha256", "value": "fe8ff4b6052f2f2bc655bcce5de91d61a07be8ee64862e31288932174f73fca2", "origin": "local", "verified": false}
          ],
          "raw_policy": "immutable",
          "integrity_status": "unverified"
        },
        {
          "artifact_id": "enwiki-20260801-linktarget-sql-gz",
          "locator_id": "drive_lake",
          "filename": "raw/wikipedia-en/2026-08-01/enwiki-20260801-linktarget.sql.gz",
          "source_url": "https://dumps.wikimedia.org/enwiki/20260801/enwiki-20260801-linktarget.sql.gz",
          "media_type": "application/sql",
          "compression": "gzip",
          "expected_bytes": 1419859095,
          "checksums": [
            {"algorithm": "sha1", "value": "430cd0ac6adbad6360d90732f9b15372b45e2acb", "origin": "publisher", "verified": false},
            {"algorithm": "sha256", "value": "673bea06212358a8a0a52803c192918c7fd78b4a8158af990321147bb4843e49", "origin": "local", "verified": false}